"ReferenceID","Authors","Year","Title","Details"
273,"Lainson R., Shaw J. J., Ryan L., Ribeiro R. S. M. & Silveira F. T.",1985,"Leishmaniasis in Brazil. XXI. Visceral leishmaniasis in the Amazon region and further observations on the role of Lutzomyia longipalpis (Lutz & Neiva, 1912) as the vector","Transactions of the Royal Society of Tropical Medicine and Hygiene, 79(2): 223-226."
274,"Ryan L., Lainson R. & Shaw J. J.",1987,"Leishmaniasis in Brazil. XXIV. Natural flagellate infections of sandflies (Diptera, Psychodidae) in Pará State, with particular reference to the role of Psychodopygus wellcomei as the vector of Leishmania braziliensis braziliensis in the Serra dos Carajas","Transactions of the Royal Society of Tropical Medicine and Hygiene, 81: 353-359."
275,"Ryan L., Shaw J. J., Braga R. R. & Ishikawa E.",1987,"Leishmaniasis in Brazil. XXV. Sandfly vectors of Leishmania in Pará State, Brazil.","Medical and Veterinary Entomology, 1(4): 383-395."
276,"Lainson R. & Shaw J. J.",1972,"Leishmaniasis of the New World : taxonomic problems.","British Medical Bulletin, 28(1): 44-48."
277,"Warburg A., Montoya J., Jaramillo C., Cruz Ruíz A. L. & Ostrovska K.",1991,"Leishmaniasis vector potential of Lutzomyia spp. in Colombian coffee plantations.","Medical and Veterinary Entomology, 5: 9-16."
278,"Aragão H. de B.",1927,"Leishmaniose tegumentar e sua transmissão pelos phlebotomos.","Memórias do Instituto Oswaldo Cruz, (Rio de Janeiro), 20: 177-185."
279,"Deane L. M.",1956,"Leishmaniose visceral no Brasil. Estudos sôbre reservatórios e transmissores realizados no Estado de Ceará.","162 pp. Faculdade Medicina Universidade de São Paulo, São Paulo (Brazil)."
280,"Figueroa García L. N.",1958,"Leishmaniose visceral. Segundo caso clinico descubierto en Guatemala.","33 pp. Instituto Investigation en Ciencias, Universidad de San Carlos., Guatemala (Guatemala)."
281,"Le Pont F.",1990,"Les phlébotomes et les leishmanioses en Bolivie.","312 pp. Université Paris Sud, Paris (France)."
282,"Vargas L. & Díaz Nájera A.",1953,"Lista de flebótomos mexicanos y su distribución geográfica (Diptera, Psychodidae).","Revista del Instituto de salubridad y enfermedades tropicales, 13(4): 309-314."
283,"Ferro C. & Morales A.",1988,"Lista de las espécies de flebótomos (Diptera, Psychodidae, Phlebotominae) de Colombia S.A.","Biomedica, 8(3): 68-70."
284,"Léger N., Abonnenc E., Pajot F. X., Kramer R. & Claustre J.",1977,"Liste commentée des phlébotomes de la Guyane française.","Cahiers ORSTOM, série Entomologie Médicale et Parasitologie, 15(3): 217-232."
285,"Llanos B. Z.",1981,"Los flebótomos del Perú y su distribución geográfica (Diptera : Psychodidae, Phlebotominae).","Revista peruana de entomologia, 24(1): 183-184."
286,"Arzube M. E.",1960,"Los Phlebotomus del Ecuador. Relato de capturas no publicadas.","Revista ecuatoriana de higiene y medicina tropical, 17(3): 155-159."
287,"Rodríguez M. J. D.",1950,"Los Phlebotomus del Ecuador (Diptera, Psychodidae). I. Consideraciones generales. Descripción de una nueva especie.","Revista ecuatoriana de higiene y medicina tropical, 7(3): 20-29."
288,"Rodríguez M. J. D.",1953,"Los Phlebotomus del Ecuador (Diptera, Psychodidae). III. Descripcion de una nueva especie.","Revista ecuatoriana de higiene y medicina tropical, 10(1): 51-55."
289,"Rodríguez M. J. D.",1956,"Los Phlebotomus del Ecuador (Diptera, Psychodidae). VI. Nuevas capturas. Descripción de una nueva especie. Resumen y distribución geográfica.","Revista ecuatoriana de higiene y medicina tropical, 13(2): 75-82."
291,"Martins A. V., Silva J. E. & Falcão A. L.",1970,"Lutzomyia (Lutzomyia) souzalopesi sp.n., nova espécie de flebótomo do Estado de Espírito Santo (Diptera, Psychodidae, Phlebotominae).","Revista brasileira de biologia, (Rio de Janeiro), 30(4): 559-562."
292,"Léger N. & Abonnenc E.",1988,"Lutzomyia (Nyssomyia) bibinae n.sp., phlébotome (Diptera : Psychodidae) de Guyane française.","Bulletin de la Société de Pathologie Exotique, 81: 136-139."
293,"Martins A. V., Falcão A. L. & Silva J. E.",1979,"Lutzomyia (Nyssomyia) fraihai n.sp., nova espécie de flebotomíneo do Estado da Bahia, Brasil (Diptera, Psychodidae).","Revista brasileira de biologia, (Rio de Janeiro), 39(2): 357-360."
294,"Le Pont F. & Pajot F. X.",1978,"Lutzomyia (Psychodopygus) corossoniensis n.sp. (Diptera : Psychodidae), nouveau phlébotome découvert en Guyane française.","Cahiers ORSTOM, série Entomologie Médicale et Parasitologie, 16(3): 223-226."
295,"Martins A. V.",1970,"Lutzomyia (Psychodopygus) fairtigi n.sp. from Colombia (Diptera, Psychodidae, Phlebotominae).","Proceedings of the Entomological Society of Washington, 72(2): 279-279."
296,"",,"",""
297,"Feliciangeli M. D., Ordoñez R. & Manzanilla P.",1984,"Lutzomyia aulari, a new phlebotomine sandfly (Diptera, Psychodidae) from Trujillo State, Venezuela.","Journal of Medical Entomology, 21(5): 592-596."
298,"Young D. G. & Porter C. H.",1974,"Lutzomyia cirrita n.sp. from Colombia with a new synonym in the genus (Diptera : Psychodidae : Phlebotominae).","Florida Entomologist, 57(3): 321-325."
299,"Ramírez Pérez J., Martins A. V. & Ramírez A.",1976,"Lutzomyia conviti n.sp. de flebótomineo da Venezuela (Diptera, Psychodidae, Phlebotominae).","Revista brasileira de biologia, (Rio de Janeiro), 36(3): 599-603."
300,"",,"",""
302,"Pérez J. E., Ogusuku E., Monje J. & Young D. G.",1991,"Lutzomyia (Dipt. : Psychodidae) de Pillcopata (Cusco), nuevos registros para el Perú y descripción de Lutzomyia deorsa n.sp.","Revista peruana de entomologia, 33(1): 133-135."
303,"Le Pont F. & Desjeux P.",1983,"Lutzomyia eliensis n.sp. (Diptera, Psychodidae) nouveau phlébotome découvert en Guyane française.","Cahiers ORSTOM, série Entomologie Médicale et Parasitologie, 21(1): 47-52."
304,"Martins A. V. & Fraiha H.",1971,"Lutzomyia evangelistai sp.n., nova espécie de flebótomo do Estado do Pará (Diptera, Psychodidae, Phlebotominae).","Revista brasileira de biologia, (Rio de Janeiro), 31(3): 361-365."
305,"Travi B. L., Vélez I. D., Brutus L., Segura I., Jaramillo C. & Montoya J.",1990,"Lutzomyia evansi, an alternate vector of Leishmania chagasi in a Colombian focus of visceral leishmaniasis.","Transactions of the Royal Society of Tropical Medicine and Hygiene, 84: 676-677."
306,"Fraiha H., Shaw J. J. & Lainson R.",1970,"Lutzomyia falciformis (Floch & Abonnenc, 1944) sinônimo de Lutzomyia monstruosa (Floch & Abonnenc, 1944).","Revista de saúde pública, São Paulo, 4(2): 215-216."
308,"",,"",""
309,"Young D. G.",1972,"Lutzomyia ignacioi, a new species of phlebotomine sandfly from Venezuela (Diptera, Psychodidae).","Journal of Medical Entomology, 9(4): 312-314."
310,"Morales A. & Ferro C.",1988,"Lutzomyia infraspinosa (Mangabeira, 1941) (Diptera, Psychodidae) nuevo registro para Colombia, S.A.","Biomedica, 8(3): 83."
311,"Feliciangeli M. D., Ordoñez R. & Fernandez E.",1984,"Lutzomyia lewisi, a new phlebotomine sandfly (Diptera, Psychodidae) from Cojedes State, Venezuela.","Memórias do Instituto Oswaldo Cruz, (Rio de Janeiro), 79(3): 357-361."
312,"Azevedo A. C. R., Rangel E. F. & Queiroz R. G.",1990,"Lutzomyia migonei (França, 1920) naturally infected with peripylarian flagellates in Baturité, a focus of cutaneous leishmaniasis in Ceára State, Brazil.","Memórias do Instituto Oswaldo Cruz, (Rio de Janeiro), 85(4): 479-479."
313,"Pajot F. X. & Le Pont F.",1978,"Lutzomyia moucheti n.sp. (Diptera : Psychodidae), nouveau phlébotome découvert en Guyane française.","Cahiers ORSTOM, série Entomologie Médicale et Parasitologie, 16: 295-297."
315,"Herrer A.",1982,"Lutzomyia peruensis Shannon, 1929, posible vector natural de la uta (Leishmaniasis tegumentaria).","Revista do Instituto de medicina tropical de São Paulo, 24(3): 168-172."
316,"Young D. G. & Arias J. R.",1977,"Lutzomyia sandflies in the subgenus Evandromyia Mangabeira with descriptions of a new species from Brazil (Diptera, Psychodidae).","Acta Amazônica, 7(1): 59-70."
317,"Martins A. V., Falcão A. L. & Silva J. E.",1975,"Lutzomyia schreiberi n.sp., nova espécie de flebotomídeo afim de Lutzomyia micropyga (Mangabeira, 1942) (Diptera, Psychodidae, Phlebotominae).","Ciência e cultura, 27(7): 766-772."
318,"Forattini O. P.",1971,"Sôbre a classificação da subfamilia Phlebotominae nas Américas (Diptera : Psychodidae).","Papéis Avulsos do Departamento de Zoologia, 24: 93-111."
319,"Martins A. V., Silva J. E. & Falcão A. L.",1971,"Lutzomyia sherlocki sp.n. do Estado de Mato Grosso, Brasil (Diptera, Psychodidae, Phlebotominae).","Revista brasileira de biologia, (Rio de Janeiro), 31(4): 415-418."
320,"Christensen H. A. & Fairchild G. B.",1971,"Lutzomyia tintinnabula n.sp. (Diptera, Psychodidae) from Panama.","Journal of Medical Entomology, 8(3): 301-303."
321,"Ward R. D. & Fraiha H.",1977,"Lutzomyia umbratilis, a new species of sandfly from Brazil (Diptera, Psychodidae).","Journal of Medical Entomology, 14(3): 313-317."
322,"Feliciangeli M. D. & Murillo J.",1987,"Lutzomyia youngi (Diptera, Psychodidae), a new phlebotomine sandfly previously misidentified as L.townsendi in endemic foci of cutaneous leishmaniasis in Venezuela and Costa Rica.","Journal of Medical Entomology, 24(2): 141-146."
323,"Young D. G. & Porter C. H.",1972,"Lutzomyia yuilli, a new man-biting phlebotomine sandfly from Colombia (Diptera : Psychodidae).","Journal of Medical Entomology, 9(6): 524-526."
324,"Bruijning C. F. A.",1957,"Man-biting sandflies (Phlebotomus) in the endemic leishmaniasis area of Surinam.","Documenta de medicina geographica e tropica, 9: 229-236."
325,"Wijers D. J. B. & Linger R.",1966,"Man-biting sandflies in Surinam (Dutch Guiana) : Phlebotomus anduzei as a possible vector of Leishmania braziliensis.","Annals of Tropical Medicine and Parasitology, 60: 501-508."
326,"Manson-Bahr P.",1925,"Manson's Tropical Diseases.","1 pp. Cassel and Co., London (Great Britain)."
328,"Lane R. P. & Ready P. D.",1985,"Multivariate discrimination between Lutzomyia wellcomei, a vector of mucocutaneous leishmaniasis and Lu. complexus (Diptera : Phlebotominae)","Annals of Tropical Medicine and Parasitology, 79(4): 469-472."
329,"Dedet J. P., Pajot F. X., Desjeux P., Goyot P., Chippaux J. P. & Geoffroy B.",1985,"Natural hosts of Leishmania mexicana amazonensis Lainson and Shaw, 1972 (Kinetoplastida: Trypanosomatidae) in French Guiana.","Transactions of the Royal Society of Tropical Medicine and Hygiene, 79: 302-305."
330,"Feliciangeli M. D., Reyes R. M. & Limongi J.",1988,"Natural infection of Lutzomyia ovallesi (Diptera : Psychodidae) with parasites of the Leishmania braziliensis complex in a restricted focus of cutaneous leishmaniasis in northern Venezuela.","Memórias do Instituto Oswaldo Cruz, (Rio de Janeiro), 83(3): 393-394."
331,"Bonfante Garrido R., Urdaneta R., Urdaneta I. & Alvarado J.",1990,"Natural infection of Lutzomyia trinidadensis (Diptera, Psychodidae) with Leishmania in Barquisimeto, Venezuela.","Memórias do Instituto Oswaldo Cruz, (Rio de Janeiro), 85(4): 477-477."
332,"Gómez E. A.",1987,"Natural infection of Sand flies with Leishmania promastigotes.","In:  Hashiguchi Y. 1987 -  Studies on New World leishmaniasis and its transmission with particular reference to Ecuador. (N°1)., Kyowa Printing and Co., Kochi City(Japan). p. 70-78."
333,"Hashiguchi Y., Gómez E. A., Vera V., Mimori T. & Kawabata M.",1985,"Natural infections with promastigotes in man-biting species of sandflies in leishmaniasis-endemic areas of Ecuador.","In:  Hashiguchi Y. 1987 -  Studies on New World leishmaniasis and its transmission with particular reference to Ecuador. (N°1)., Kyowa Printing and Co., Kochi City(Japan). p. 440-446."
334,"Chaniotis B. N., Neely J. M., Correa M. A., Tesh R. B. & Johnson K. M.",1971,"Natural population dynamics of phlebotomine sandflies in Panama.","Journal of Medical Entomology, 8: 339-352."
335,"Lutz A.",1922,"Nematoceros hematofagos nao pertencendo aos culicideos.","Folha medica, 3(12): 89-92."
336,"Intermill R. W. & Müller W. B.",1976,"New distribution records for Lutzomyia gomezi (Nitzulescu) and L.chiapanensis (Dampt) from Honduras.","Mosquito News, 36(4): 543-543."
337,"Ryan L., Fraiha H., Lainson R. & Shaw J. J.",1986,"New phlebotomine sandflies of the Walkeri group (Diptera, Psychodidae) from Pará State, Brazil, with a pictorial key.","Memórias do Instituto Oswaldo Cruz, (Rio de Janeiro), 81(3): 323-331."
338,"Young D. G. & Arias J. R.",1982,"A new phlebotomine sandfly in the Lutzomyia flaviscutellata complex (Diptera, Psychodidae) from Northern Brazil.","Journal of Medical Entomology, 19(2): 134-138."
339,"Young D. G., Pérez J. E. & Romero G.",1985,"New records of phlebotomine sandflies from Peru with a description of Lutzomyia oligodonta n.sp. from the Rimac Valley (Diptera : Psychodidae).","International Journal of Entomology, (Honolulu), 27(1): 136-146."
340,"Hudson J. E. & Young D. G.",1985,"New records of phlebotomines, leishmaniasis and mosquitoes from Suriname.","Transactions of the Royal Society of Tropical Medicine and Hygiene, 79: 418-419."
341,"Young D. G. & Morales A.",1987,"New species and records of phlebotomine sandflies from Colombia (Diptera, Psychodidae).","Journal of Medical Entomology, 24(6): 651-665."
342,"Young D. G. & Lawyer P. G.",1987,"New World Vectors of the leishmaniases.","In:  Harris K. F. 1987 -  Current topics in vector research., Springer-Verlag, New York(United States of America). p. 29-71."
343,"Paterson G. C. & Shannon R. C.",1926,"Nota preliminar sobre Phleb. araozi, n.sp.","Semana médica, (Buenos Aires), 33: 236-237."
344,"Castro M.",1960,"Notas sobre flebotomineos argentinos con la descripción de Flebotomus misionensis n.sp. (Diptera, Psychodidae).","Primeras Jornadas Entomoepidemiologicas Argentinas, 1: 331-334."
345,"Coutinho J. O.",1939,"Nota sôbre flebótomos sulamericanos.","Boletim Biológico. Laboratorio de parasitologia, Faculdade de medicina de Sao Paulo., 4(2): 181-183."
346,"Duret J. P.",1950,"Nota sôbre flebótomos y culicidos del Paraguay.","Revista de la sanidad militar argentina, 49(3): 251-252."
347,"Martins A. V., Falcão A. L., Silva J. E. & Dias E. S.",1984,"Nota sôbre Lutzomyia (Lutzomyia) cruzi (Mangabeira, 1938), com a descrição da fêmea (Diptera, Psychodidae, Phlebotominae).","Memórias do Instituto Oswaldo Cruz, (Rio de Janeiro), 79(4): 439-442."
348,"Martins A. V., Falcão A. L. & Silva J. E.",1973,"Notas sôbre Lutzomyia (Psychodopygus) davisi (Root, 1934) (Diptera, Psychodidae, Phlebotominae), com a descrição da fêmea.","Revista brasileira de biologia, (Rio de Janeiro), 33(3): 419-425."
349,"Martins A. V., Falcão A. L., Silva J. E. & Miranda Fo R.",1983,"Nota sôbre Lutzomyia (Trichopygomyia) dasypodogeton (Castro, 1939), com a redescrição do macho e da fêmea (Diptera, Psychodidae, Phlebotomine).","Memórias do Instituto Oswaldo Cruz, (Rio de Janeiro), 78(2): 223-230."
350,"Martins A. V., Godoy Jr T. L. & Silva J. E.",1962,"Nota sôbre os flebótomos de Petropolis, Estado do Rio de Janeiro, com a descrição de uma nova espécies (Diptera, Psychodidae).","Revista brasileira de biologia, (Rio de Janeiro), 22(1): 55-60."
351,"Martins A. V., Falcão A. L. & Silva J. E.",1962,"Nota sôbre os flebótomos do Estado de Goiás, com a descrição de duas espécies novas e da fêmea de Lutzomyia longipennis (Barretto, 1946) e a redescrição do macho da L.evandroi (Costa Lima & Antunes, 1936) (Diptera, Psychodidae).","Revista brasileira de malariologia e doenças tropicais, (Rio de Janeiro), 14(4): 379-399."
352,"Martins A. V., Godoy Jr T. L. & Silva J. E.",1961,"Nota sôbre os flebótomos dos Estados do Paraná e Santa Catarina, com a redescrição da "Lutzomyia gaminarai" (Cordero, Vogelsang & Cossio, 1928) (Diptera, Psychodidae).","Revista brasileira de biologia, (Rio de Janeiro), 21(3): 309-316."
353,"Forattini O. P.",1971,"Nota sôbre Psychodopygus squamiventris (Lutz & Neiva, 1912) e espécies afins (Diptera, Psychodidae).","Revista de saúde pública, São Paulo, 5(1): 151-154."
355,"Fonseca F.",1935,"Nota sôbre uma espécie de Flebotomus do Brasil (Diptera, Psychodidae).","Memórias do Instituto Butantan, (São Paulo), 10: 61-62."
356,"Rodríguez M. J. D.",1953,"Notas adicionales sobre la especie ecuatoriana Phlebotomus (Pressatia) camposi (Rodriguez, 1952) (Diptera, Psychodidae).","Revista ecuatoriana de entomologia, 1(2): 91-96."
357,"Ortíz I. & Scorza J. V.",1963,"Notas biologicas y taxonómicas sobre algunos Phlebotominae (Diptera, Psychodidae) de Rancho Grande, Venezuela.","Acta Biologica Venezuelica, 3(23): 341-361."
358,"Barreto P., Montoya J., Solarte Y., Jaramillo C., Barreto M., Freyre J. L. & Sánchez A.",1989,"Notas sobre algunos flebótomos Lutzomyia (Diptera : Psychodidae) en tres focos de leishmaniasis cutánea en el occidente de Colombia.","Colombia médica, 20(2): 53-59."
360,"Dampf A.",1947,"Notas sobre flebotómidos mexicanos. III. Un nuevo flebótomo (P. chiapanensis n.sp.) aparentemente antropófilo.","Medicina (Mexico), 27: 179-183."
361,"Dampf A.",1947,"Notas sobre flebotómidos mexicanos. IV. El macho de Phlebotomus vindicator Dampf, 1945.","Revista de la Sociedad mexicana de historia natural, 8: 205-213."
362,"Dampf A.",1944,"Notas sobre flebotómidos mexicanos. Observaciones generales y descripcion de dos especies nuevas (Phlebotomus oppidanus y Phlebotomus vindicator), encontradas en la Ciudad de México (Ins. Diptera, Fam. Phlebotomidae).","Revista de la Sociedad mexicana de historia natural, 5: 237-254."
512,"Cordero E. H., Vogelsang E. G. & Cossio V.",1928,"Phlebotomus gaminarai n.sp., nueva especie de flebótomo del Uruguay.","Boletín del Instituto de clínica quirúrgica, (Buenos Aires), 4(28): 649-652."
363,"Barretto M. P., Martins A. V. & Pellegrino J.",1956,"Notas sôbre flebotomíneos do nordeste do Estado de Minas Gerais, com as descrições de duas espécies novas (Diptera, Psychodidae).","Folia clinica et biologica, 26: 47-56."
364,"Duret J. P.",1952,"Notas sobre flebótomos argentinos.","Revista de la sanidad militar argentina, 51(4): 534-536."
365,"Blancas F.",1959,"Notas sobre flebótomos Peruanos. Enumeración de las especies de flebótomos encontrados en el Perú y descripción de una especie nueva, Phlebotomus gorbitzi n.sp. (Diptera, Psychodidae).","Revista de medicina experimental, 13: 125-133."
366,"Antunes P. C. A.",1937,"Notas sôbre Flebotomos Sul-Americanos. I. Um novo Flebotomus, Flebotomus lloydi, encontrado em São Paulo (Diptera, Psychodidae).","Revista de biologia e higiene, 8: 24-26."
367,"Antunes P. C. A. & Coutinho J. O.",1939,"Notas sôbre Flebotomos Sul-Americanos. II. Descrição de Flebotomus whitmani n.sp. e da armadura bucal de algumas espécies.","Boletim Biológico (N.S.), 4(3): 448-453."
368,"Velasco J. E. & Martins A. V.",1974,"Notas sôbre Lutzomyia nevesi (Damasceno & Arouck, 1956), com a descrição da fêmea (Diptera, Psychodidae, Phlebotominae).","Revista brasileira de biologia, (Rio de Janeiro), 34(1): 93-97."
369,"Sherlock I. A. & Guitton N.",1970,"Notas sôbre o subgênero Trichophoromyia Barretto, 1961 (Diptera, Psychodidae, Phlebotominae).","Revista brasileira de biologia, (Rio de Janeiro), 30(3): 137-150."
370,"Martins A. V. & Silva J. E.",1964,"Notas sôbre os flebótomos do Estado do Acre, com a descrição de duas espécies novas (Diptera, Psychodidae).","Revista brasileira de biologia, (Rio de Janeiro), 24(2): 127-138."
372,"Martins A. V., Dias E. S., Falcão A. L. & Silva J. E.",1989,"Notas sôbre os flebótomos dos Estados do Ceará e Piauí, com a descrição da fêmea de Lutzomyia samueli (Deane, 1955) (Diptera : Psychodidae : Phlebotominae).","Memórias do Instituto Oswaldo Cruz, (Rio de Janeiro), 84(4): 353-356."
373,"Martins A. V., Maciel C. S. & Silva J. E.",1968,"Notas sôbre os flebotomos do grupo squamiventris do subgênero Psychodopygus Mangabeira, 1941 (Diptera, Psychodidae).","Boletim do Museu de História Natural da Universidade Federal de Minas Gerais, 1: 1-33."
374,"Martins A. V., Falcão A. L. & Silva J. E.",1965,"Notas sôbre os flebótomos do Território de Rondônia, com a descrição de seis espécies novas (Diptera Psychodidae).","Revista brasileira de biologia, (Rio de Janeiro), 25(1): 1-20."
376,"Martins A. V., Falcão A. L. & Silva J. E.",1963,"Notas sôbre os flebótomos do Território de Roraima, com a descrição de três novas espécies (Diptera, Psychodidae).","Revista brasileira de biologia, (Rio de Janeiro), 23(4): 333-348."
378,"Forattini O. P.",1960,"Notas sôbre Phlebotomus do Território do Amapá, Brasil (Diptera, Psychodidae).","Studia entomologica, 11(1): 467-480."
379,"Fauran P.",1960,"Note sur la morphologie de Phlebotomus brachipygus, P.campbelli, P.carvalhoi, P.fariasi, P.tuberculatus (Diptera, Psychodidae), signalés pour la première fois en Guyane.","8 pp. Archives de l'Institut Pasteur de Guyane française et du Territoire de l'Inini, Cayenne (France - French Guiana)."
380,"Geoffroy B., Dedet J. P., Lebbe J., Esterre P. & Trape J. F.",1986,"Note sur les relations des vecteurs de leishmaniose avec les essences forestières en Guyane Française.","Annales de Parasitologie humaine et comparée, 61(4): 483-490."
381,"Dyar H. G. & Nuñez-Tovar M.",1926,"Notes on biting flies from Venezuela.","Insecutor Inscitiae Menstruus, 14(10): 152-155."
382,"Williams P.",1988,"Notes on Lutzomyia (Helcocyrtomyia) trinidadensis (Newstead, 1922) (Diptera, Psychodidae, Phlebotominae).","Memórias do Instituto Oswaldo Cruz, (Rio de Janeiro), 83(3): 375-383."
383,"Newstead R.",1914,"Notes on Phlebotomus with descriptions of new species. Part II.","Bulletin of Entomological Research, (London), 5(2): 179-192."
386,"Hertig M.",1943,"Notes on Peruvian sandflies with descriptions of Phlebotomus battistinii n.sp. and P.pescei n.sp.","American Journal of Tropical Medicine and Hygiene, 37(3): 246-254."
387,"Fairchild G. B. & Hertig M.",1950,"Notes on the Phlebotomus of Panama (Diptera, Psychodidae). VI. Phlebotomus shannoni Dyar and related species.","Annals of the Entomological Society of America, 43(4): 523-533."
388,"Fairchild G. B. & Hertig M.",1953,"Notes on the Phlebotomus of Panama (Diptera, Psychodidae). X. P.aragaoi, P.barrettoi and two new species.","Annals of the Entomological Society of America, 46(1): 21-34."
389,"Fairchild G. B. & Hertig M.",1947,"Notes on the Phlebotomus of Panama (Diptera, Psychodidae). I. The subgenus Brumptomyia França and Parrot, 1921.","Annals of the Entomological Society of America, 40(4): 610-616."
391,"Fairchild G. B. & Hertig M.",1947,"Notes on the Phlebotomus of Panama (Diptera, Psychodidae). II. Descriptions of three new species.","Annals of the Entomological Society of America, 40(4): 617-623."
392,"Fairchild G. B. & Hertig M.",1948,"Notes on the Phlebotomus of Panama (Diptera, Psychodidae). III. P. cruciatus Coq., trinidadensis Newst., and gomezi Nitz.","Annals of the Entomological Society of America, 41(2): 247-257."
393,"Fairchild G. B. & Hertig M.",1948,"Notes on the Phlebotomus of Panama (Diptera, Psychodidae). IV. P.atroclavatus Knab, P. cayennensis Floch and Abonnenc, P. chiapanensis Dampf and some related forms from the West Indies and Mexico.","Annals of the Entomological Society of America, 41(4): 455-467."
396,"Fairchild G. B. & Hertig M.",1951,"Notes on the Phlebotomus of Panama (Diptera, Psychodidae). VII. The subgenus Shannonomyia Pratt.","Annals of the Entomological Society of America, 44(3): 399-421."
398,"Fairchild G. B. & Hertig M.",1951,"Notes on the Phlebotomus of Panama (Diptera, Psychodidae). VIII. Two new species of Warileya.","Annals of the Entomological Society of America, 44(3): 422-429."
400,"Fairchild G. B. & Hertig M.",1952,"Notes on the Phlebotomus of Panama. IX. Descriptions of seven new species.","Annals of the Entomological Society of America, 45(4): 505-528."
403,"Fairchild G. B. & Hertig M.",1956,"Notes on the Phlebotomus of Panama (Diptera, Psychodidae). XII. The group anthophorus with descriptions of four new species from Panama and Mexico.","Annals of the Entomological Society of America, 49(4): 307-312."
404,"Fairchild G. B. & Hertig M.",1957,"Notes on the Phlebotomus of Panama. XIII. The vexator group, with descriptions of new species from Panamá and California.","Annals of the Entomological Society of America, 50(4): 325-334."
406,"Fairchild G. B. & Hertig M.",1958,"Notes on the Phlebotomus of Panama. XIV.(Diptera, Psychodidae). P.vespertilionis and related species.","Annals of the Entomological Society of America, 51(6): 509-516."
407,"Fairchild G. B. & Hertig M.",1958,"Notes on the Phlebotomus of Panama. XV. Four apparently new synonymies (Diptera, Psychodidae).","Proceedings of the Entomological Society of Washington, 60: 203-205."
408,"Fairchild G. B. & Hertig M.",1961,"Notes on the Phlebotomus of Panama. XVI.(Diptera, Psychodidae). Descriptions of new and little-known species from Panama and Central America.","Annals of the Entomological Society of America, 54(2): 237-255."
410,"Larrousse F.",1922,"Nouvelle espèce américaine du genre Phlebotomus, P. tejerae et tableau permettant de déterminer les mâles des différentes espèces de ce genre","Bulletin de la Société zoologique de France, 47: 41-46."
411,"Larrousse F.",1920,"Nouvelle espèce américaine du genre Phlebotomus, Phlebotomus brumpti, sp.nov","Bulletin de la Société de Pathologie Exotique, 12: 659-662."
412,"Barretto M. P.",1951,"Nova contribuição para o estudo da distribuição geográfica dos flebótomos Americanos (Diptera, Psychodidae).","Arquivos de Higiene e Saúde Pública, (São Paulo), 15(46): 211-226."
413,"Barretto M. P.",1955,"Nova espécie de flebótomo do Brasil (Diptera, Psychodidae).","Revista do Hospital das clínicas, 10(4): 247-249."
