"ReferenceID","Authors","Year","Title","Details"
1,"Ristorcelli A. & Van ty D.",1941,"III. Phlébotomes d'une région de Colombie où la verruga du Pérou est devenue endémique depuis deux ou trois ans (Seconde note).","Annales de Parasitologie humaine et comparée, 18(4): 251-269."
2,"Mangabeira Fo O.",1941,"2ª Contribuição ao estudo dos Flebotomus. Flebotomus edwardsi n.sp. (Diptera, Psychodidae).","Memórias do Instituto Oswaldo Cruz, (Rio de Janeiro), 36(2): 201-213."
3,"Mangabeira Fo O.",1941,"3ª Contribuição ao estudo dos Flebotomus. Evandromyia n.subg. (Diptera, Psychodidae).","Memórias do Instituto Oswaldo Cruz, (Rio de Janeiro), 36(2): 215-223."
5,"Mangabeira Fo O.",1941,"4ª Contribuição ao estudo dos Flebotomus. Psychodopygus n.subg. (Diptera, Psychodidae).","Memórias do Instituto Oswaldo Cruz, (Rio de Janeiro), 36(3): 237-250."
6,"Mangabeira Fo O.",1941,"5ª Contribuição ao estudo dos Flebotomus. Viannamyia n.subg. (Diptera, Psychodidae).","Memórias do Instituto Oswaldo Cruz, (Rio de Janeiro), 36(3): 251-262."
7,"Mangabeira Fo O.",1941,"6ª Contribuição ao estudo dos Flebotomus. Flebotomus (Pintomyia) damascenoi n.sp. (Diptera, Psychodidae).","Memórias do Instituto Oswaldo Cruz, (Rio de Janeiro), 36(3): 369-377."
8,"Mangabeira Fo O.",1942,"7ª Contribuição ao estudo dos Flebotomus. Descrição dos machos de 24 novas espécies (Diptera, Psychodidae).","Memórias do Instituto Oswaldo Cruz, (Rio de Janeiro), 37(2): 111-218."
10,"Mangabeira Fo O.",1942,"8ª Contribuição ao estudo dos Flebotomus. (Diptera, Psychodidae). Flebotomus (Brumptomyia) avellari Costa Lima, 1932.","Memórias do Instituto Oswaldo Cruz, (Rio de Janeiro), 37(2): 225-240."
13,"Mangabeira Fo O.",1942,"9ª Contribuição ao estudo dos Flebotomus. (Diptera, Psychodidae). Flebotomus (Pressatia) triacanthus (Mangabeira, 1942).","Memórias do Instituto Oswaldo Cruz, (Rio de Janeiro), 37(3): 241-250."
14,"Mangabeira Fo O.",1942,"10ª Contribuição ao estudo dos Flebotomus. (Diptera, Psychodidae). Flebotomus longispinus (Mangabeira, 1942).","Memórias do Instituto Oswaldo Cruz, (Rio de Janeiro), 37(3): 251-257."
15,"Mangabeira Fo O.",1942,"11ª Contribuição ao estudo dos Flebotomus. (Diptera, Psychodidae), Flebotomus oswaldoi Mangabeira, 1942.","Memórias do Instituto Oswaldo Cruz, (Rio de Janeiro), 37: 287-295."
16,"Mangabeira Fo O.",1942,"12ª Contribuição ao estudo dos Flebotomus. (Diptera, Psychodidae) : Flebotomus nordestinus n.sp.","Memórias do Instituto Oswaldo Cruz, (Rio de Janeiro), 37(3): 327-331."
17,"Mangabeira Fo O.",1942,"13ª Contribuição ao estudo dos Flebotomus. (Diptera, Psychodidae) : Flebotomus (Brumptomyia) travassosi Mangabeira, 1942.","Memórias do Instituto Oswaldo Cruz, (Rio de Janeiro), 37(3): 375-381."
18,"Knab F.",1913,"A new American Phlebotomus (Diptera, Psychodidae).","Insecutor Inscitiae Menstruus, 1(1): 135-137."
21,"Fairchild G. B.",1949,"A new fly related to Phlebotomus from Panama (Diptera, Psychodidae).","Proceedings of the Entomological Society of Washington, 51(2): 81-84."
22,"Hertig M.",1948,"A new genus of bloodsucking Psychodids from Perú (Diptera, Psychodidae).","Annals of the Entomological Society of America, 41(1): 8-16."
23,"Young D. G., Brenner R. J. & Wargo M. J.",1983,"A new phlebotomine sandfly (Diptera, Psychodidae) from Southern California, USA.","Journal of Medical Entomology, 20: 313-315."
24,"Young D. G. & Murillo J.",1984,"A new phlebotomine sandfly, Lutzomyia zeledoni n.sp. (Diptera, Psychodidae) from Central America.","Journal of Medical Entomology, 21(8): 711-713."
25,"Arias J. R., Freitas R. A. & Barrett T. V.",1984,"A new sandfly in the subgenus Nyssomyia (Diptera, Psychodidae) from the Amazon Basin of Brazil.","Memórias do Instituto Oswaldo Cruz, (Rio de Janeiro), 79(3): 325-327."
26,"Wijers D. J. B. & Huisenga J.",1967,"A new species of Lutzomyia from Surinam (Diptera, Psychodidae).","Bulletin of Entomological Research, (London), 57: 395-397."
27,"Cazorla D.",1988,"A new species of Lutzomyia (Diptera : Psychodidae) from Venezuelan Andes Region.","Revista brasileira de biologia, (Rio de Janeiro), 48(3): 607-610."
28,"Porter C. H. & Young D. G.",1986,"A new species of phlebotomine sandfly (Diptera, Psychodidae) from Guatemala.","Journal of Medical Entomology, 23(3): 236-243."
29,"Summers S. L. M.",1912,"A new species of Phlebotomus from South America.","Bulletin of Entomological Research, (London), 3: 209-210."
30,"Newstead R.",1922,"A new species of Phlebotomus from Trinidad.","Annals of Tropical Medicine and Parasitology, 16(1): 47-50."
32,"Fraiha H. & Ward R. D.",1974,"A new species of Psychodopygus Mangabeira (Diptera, Phlebotominae) from the Transamazônica highway, Para State, Brazil.","Bulletin of Entomological Research, (London), 64: 209-212."
33,"Fairchild G. B.",1953,"A note on Hertigia hertigi Fairchild and description on the female.","Proceedings of the Entomological Society of Washington, 55: 101-102."
34,"Young D. G.",1979,"A review of the bloodsucking psychodid flies of Colombia (Diptera, Phlebotominae and Sycoracinae).","266 pp. Agricultural Experiment Stations, Institute of Food and Agricultural Sciences University of Florida, Gainesville (Florida) (United States of America)."
35,"Grimaldi G., Tesh R. B. & Mc Mahon-Pratt D.",1989,"A review of the geographic distribution and epidemiology of leishmaniasis in the New World.","American Journal of Tropical Medicine and Hygiene, 41(6): 687-725."
36,"Arias J. R., Ready P. D. & Freitas R. A.",1983,"A review of the subgenus Trichopygomyia Barretto, 1962, with description of a new species from the Brazilian Amazon Basin (Diptera, Psychodidae, Phlebotominae).","Memórias do Instituto Oswaldo Cruz, (Rio de Janeiro), 78(4): 449-472."
37,"Mármol León M. P.",1968,"Phlebotomus (Diptera, Psychodidae) encontrados en Zipayare, con la redescripción de tres espécies nuevas para Venezuela.","Kasmera, 3(1): 61-71."
38,"Morales A., Corredor A., Caceres E., Ibagos A. L. & Rodriguez C.",1981,"Aislamiento de tres cepas de Leishmania a partir de Lutzomyia trapidoi en Colombia.","Biomedica, 1(4): 198-207."
39,"Sherlock I. A. & Carneiro M.",1962,"Algumas fêmeas de Phlebotomus do Brasil (Diptera, Psychodidae).","Memórias do Instituto Oswaldo Cruz, (Rio de Janeiro), 60(3): 423-435."
40,"Llanos B. Z.",1961,"Algunos Phlebotomus de la costa norte Peruana. Valles: Tumbes, Piura y Chira.","?:."
41,"Martins A. V., Williams P. & Falcão A. L.",1978,"American sand flies (Diptera, Psychodidae, Phlebotominae).","195 pp. Academia Brasileira de Ciências, Rio de Janeiro (Brazil)."
42,"Fairchild G. B.",1943,"An annotated list of the bloodsucking insects, ticks and mites know from Panama.","American Journal of Tropical Medicine and Hygiene, 23: 569-591."
43,"Zeledón R. & Murillo J.",1983,"Anthropophilic sandflies of Nicaragua, Central America.","Transactions of the Royal Society of Tropical Medicine and Hygiene, 27(2): 280-281."
44,"Aitken T. H. G., Worth C. B. & Tikasingh E. S.",1968,"Arbovirus studies in Bushbush Forest Trinidad, W.I., September 1959 - December 1964. Entomologic studies.","American Journal of Tropical Medicine and Hygiene, 17(2): 253-268."
45,"Barreto P.",1969,"Arthropodos hematófagos del Río Raposo, Valle, Colombia. IV. Psychodidae.","Caldasia, 10(49): 459-472."
46,"Pinto C.",1930,"Phlebótomos. In : Arthrópodes parasitos e transmissores de doenças.","1 Pimenta de Mello & Cia, Rio de Janeiro (Brazil)."
47,"Aguiar G.  M., Vilela M. L., Schuback P. D. A., Soucasaux T. & Azevedo A. C. R.",1985,"Aspectos da ecologia dos flebótomos do Parque Nacional da Serra dos Órgãos, Rio de Janeiro. IV. Freqüência mensal em armadilhas luminosas (Diptera, Psychodidae, Phlebotominae).","Memórias do Instituto Oswaldo Cruz, (Rio de Janeiro), 80(4): 465-482."
48,"Gomes A. C. & Galati E. A. B.",1989,"Aspectos ecológicos da leishmaniose tegumentar americana. 7 - Capacidade vetorial flebotomínea em ambiante florestal primário do sistema da Serra do Mar, regiáo do Vale do Ribeira, Estado de São Paulo, Brasil.","Revista de saúde pública, São Paulo, 23(2): 136-142."
49,"Gomes A. C., Coutinho S. G., Paim G. V., Oliveira S. M. O., Galati E. A. B., Nunes M. P., Capinzaiki A. N., Yamamoto Y. I. & Rotter P.",1990,"Aspectos ecológicos da leishmaniose tegumentar americana. 8 . Avaliação da atividade enzoótica de Leishmania (Viannia) braziliensis, em ambiente florestal e peridomiciliar, região do Vale do Ribeira, Estado de São Paulo, Brasil.","Revista do Instituto de medicina tropical de São Paulo, 32(2): 105-115."
50,"Christensen H. A. & Herrer A.",1973,"Attractiveness of sentinel animals to vectors of leishmaniasis in Panama.","American Journal of Tropical Medicine and Hygiene, 22: 578-584."
51,"Martins A. V. & Silva J. E.",1968,"Barrettomyia n.subg., com a descrição de uma espécie nova e da fêmea de Lutzomyia (Barrettomyia) costalimai (Mangabeira, 1942).","Boletim do Museu de História Natural da Universidade Federal de Minas Gerais, 3: 1-15."
52,"Pifano F., Ortíz I. & Alvarez A.",1962,"Bases taxonómicas para el conocimiento de los Phlebotomus de la región de Guatopo, Venezuela.","Archivos venezolanos de Medicina Tropical y Parasitología Médica, 4(2): 369-428."
144,"Floch H. & Abonnenc E.",1946,"Distribution des phlébotomes en Guyane française.","7 pp. Institut Pasteur de la Guyane et du Territoire de l'Inini, Cayenne (France - French Guiana)."
54,"Le Pont F., Caillard T., Tibayrenc M. & Desjeux P.",1986,"Bolivian phlebotomines. II. Psychodopygus yucumensis n.sp., a new man-biting phlebotomine sandfly from subandean region (Diptera, Psychodidae).","Memórias do Instituto Oswaldo Cruz, (Rio de Janeiro), 81(1): 79-85."
55,"Ready P. D. & Fraiha H.",1981,"Brazilian phlebotomines. VI. Lutzomyia richardwardi sp.n., a new species of Nyssomyia from Amazônia with keys for this subgenus (Diptera, Psychodidae).","Revista brasileira de biologia, (Rio de Janeiro), 41(4): 705-712."
56,"Vexenat J. A., Barreto A. C., Cuba C. C. & Marsden P. D.",1986,"Características epidemiológicas da leishmaniose tegumentar americana em uma região endêmica do Estado da Bahia. III. Fauna flebotomínica.","Memórias do Instituto Oswaldo Cruz, (Rio de Janeiro), 81(3): 293-301."
57,"Fraiha H. & Ward R. D.",1980,"Caracterização do macho de Psychodopygus amazonensis (Root, 1934) (Diptera, Psychodidae, Phlebotominae).","Revista da Fundação de Serviços de Saúde Pública - FSESP -, (Belém), 25(1): 15-19."
58,"Barretto M. P.",1947,"Catálogo dos flebótomos Americanos.","Arquivos de Zoologia do Estado de São Paulo, 5(24): 177-242."
59,"Travassos da Rosa A. P. A., Tesh R. B., Pinheiro F. P., Travassos da Rosa J. F. S., Norman E. & Peterson E.",1983,"Characterization of eight new Phlebotomus fever serogroup arboviruses (Bunyaviridae, Phlebovirus) from the Amazon region of Brazil.","American Journal of Tropical Medicine and Hygiene, 32(5): 1164-1171."
60,"Kreutzer R. D., Corredor A., Grimaldi G., Grogl M., Rowton E., Young D. G., Morales A., Mc Mahon-Pratt D., Guzmán H. & Tesh R. B.",1991,"Characterization of Leishmania colombiensis sp.n. (Kinetoplastida : Trypanosomatidae), a new parasite infecting humans, animals and phlebotomine sandflies in Colombia and Panama.","American Journal of Tropical Medicine and Hygiene, 44(6): 662-675."
61,"Barretto M. P.",1950,"Chaves para os flebótomos Brasileiros (Diptera, Psychodidae).","Anais da Faculdade de medicina da Universidade de São Paulo, 25: 101-117."
62,"Christensen H. A.",1972,"Check list of the phlebotomine sandflies (Diptera: Psychodidae) of Panama including two species not previously reported.","Mosquito News, 32(1): 88-89."
63,"Ward R. D. & Ready P. D.",1975,"Chorionic sculpturing in some sandfly eggs (Diptera, Psychodidae).","Journal of Medical Entomology, 50(2): 127-134."
64,"",,"",""
65,"",,"",""
66,"Buck A. A., Sasaki T. T., Anderson R. I., Hitchcock J. C. & Leigh G. R.",1967,"Comprehensive epidemiologic studies of four contrasting Peruvian villages.","271 pp. Geographic Epidemiology Unit of John's Hopkins University, Baltimore (Maryland) (United States of America)."
67,"Pifano F.",1962,"Comprobación de un foco de leishmaniasis visceral en un sector del pledemonte andino-llanero del Estado Portuguesa.","Archivos venezolanos de Medicina Tropical y Parasitología Médica, 4(2): 3-15."
68,"Pifano F., Romero J. & Alvarez A.",1973,"Comprobación de una cepa de Leishmania dermotropa en Phlebotomus flaviscutellata Mangabeira, 1942, de la Sierra Parima, Territorio Federal Amazonas Venezuela.","Archivos venezolanos de Medicina Tropical y Parasitología Médica, 5(2): 145-170."
69,"Lebbe J., Vignes R. & Dedet J. P.",1987,"Identification assistée par ordinateur des Phlébotomes de Guyane Française. Computer aided identification of phlebotomine sandflies of French Guiana (Diptera : Psychodidae).","165 pp. Institut Pasteur de la Guyane française, Cayenne (France - French Guiana)."
70,"",,"",""
71,"Bejarano J. F. R. & Duret J. P.",1950,"Contribución al conocimiento de los flebótomos argentinos (Diptera, Psychodidae).","Revista de la sanidad militar argentina, 49(4): 327-336."
72,"Ortíz I.",1965,"Contribución al estudio de los flebótomos americanos del grupo cayennensis con la descripción de una nueva especie : Phlebotomus yencanensis.","Acta Biologica Venezuelica, 4(7): 205-211."
73,"Ortíz I.",1965,"Contribución al estudio de los flebótomos americanos del grupo sanguinarius con la descripción de una nueva especie : Phlebotomus scorzai n.sp. (Diptera, Psychodidae).","Acta Biologica Venezuelica, 5(2): 25-39."
74,"Rosabal R.",1966,"Contribución al estudio de los Phlebotomus de Costa Rica (Diptera : Psychodidae). II. Presencia de P. barrettoi y P. ovallesi en Costa Rica.","Revista de Biologia Tropical, 14(1): 1-2."
75,"De León J. R.",1971,"Contribución al estudio de los Phlebotomus (Diptera, Psychodidae). Phlebotomus del grupo anthophorus en Guatemala.","Revista del Colegio médico de Guatemala, 22(3): 187-193."
76,"Corredor A., Osorno-Mesa E. A. & Parra J.",1970,"Contribución al estudio epidemiológico del kala-azar en Colombia.","Revista de la Facultad de medicina de Bogotá, (Colombia), 37(1): 90-94."
77,"Rosabal R.",1954,"Contribución al estudio de los Phlebotomus de Costa Rica (Diptera : Psychodidae).","1"
78,"Coutinho J. O. & Barretto M. P.",1940,"Contribuição para o conhecimento dos flebótomos de São Paulo : Phlebotomus fischeri Pinto, 1926 e Phlebotomus pessoai n.sp. (Dipt., Psychodidae).","Revista de biologia e higiene, 10(2): 89-104."
79,"Barretto M. P. & Coutinho J. O.",1940,"Contribuição ao conhecimento dos flebótomos de São Paulo. II. Descrição do macho de Phlebotomus limai Fonseca, 1935 e de duas novas espécies : Phlebotomus ayrozai e P.amarali (Diptera, Psychodidae).","Anais da Faculdade de medicina da Universidade de São Paulo, 16(1): 127-139."
80,"Coutinho J. O. & Barretto M. P.",1940,"Contribuição para o conhecimento dos flebótomos de São Paulo. III. Descrição do macho de Phlebotomus alphabeticus Fonseca, 1936 e de Phlebotomus pascalei n.sp. (Diptera : Psychodidae).","Anais da Faculdade de medicina da Universidade de São Paulo, 16(1): 193-206."
81,"Barretto M. P. & Coutinho J. O.",1941,"Contribuição ao conhecimento dos flebótomos de São Paulo. IV. Descrição de três novas espécies.","Papéis Avulsos do Departamento de Zoologia, 1(24): 143-158."
82,"Barretto M. P. & Coutinho J. O.",1941,"Contribuição ao conhecimento dos flebótomos de São Paulo. V. Descrição do macho de P.monticolus Costa Lima, 1932 e duas novas espécies.","Papéis Avulsos do Departamento de Zoologia, 1(19): 177-192."
83,"Barretto M. P. & Coutinho J. O.",1941,"Contribuição ao conhecimento dos flebótomos de São Paulo. VI. Descrição de duas novas espécies (Diptera, Psychodidae).","Papéis Avulsos do Departamento de Zoologia, 1(24): 223-236."
84,"Coutinho J. O. & Barretto M. P.",1941,"Contribuição ao conhecimento dos flebótomos de São Paulo. VII. Descrição de Phlebotomus guimaraesi, n.sp. e das fêmeas de Phlebotomus pestanai Barretto e Coutinho, 1941e de Phlebotomus lanei Barretto e Coutinho, 1941 (Diptera, Psychodidae).","Revista de biologia e higiene, 11(11): 74-88."
85,"Barretto M. P. & Coutinho J. O.",1943,"Contribuição para o conhecimento dos flebótomos de São Paulo. VIII. Descrição da femêa de P.ayrozai Barretto & Coutinho, 1940 e do macho de P.basispinosus n.sp. (Diptera, Psychodidae).","Revista brasileira de biologia, (Rio de Janeiro), 3(2): 183-189."
87,"Galvão A. L. A. & Coutinho J. O.",1939,"Contribuição ao estudo dos Flebotomus do Estado de São Paulo. Flebotomus sallesi, n.sp. (Diptera, Psychodidae).","Anais da Faculdade de medicina da Universidade de São Paulo, 15: 125-139."
88,"Lutz A. & Neiva A.",1912,"Contribuição para o conhecimento das espécies do genero Phlebotomus existentes no Brasil.","Memórias do Instituto Oswaldo Cruz, (Rio de Janeiro), 4(1): 84-95."
89,"Barretto M. P. & Pessôa S. B.",1946,"Contribuição para o estudo da distribuição geografica dos flebótomos americanos (Diptera: Psychodidae).","Livro em homenagem a Romualdo Ferreira de Almeida, 7: 77-102."
90,"Shannon R. C. & Del Ponte E.",1927,"Cuatro notas sobre especies nuevas de dipteros nematóceros, hematófagos o no, de la República Argentina.","Revista del Instituto bacteriológico, 4(1): 724-726."
93,"Zeledón R., Macaya G., Ponce C., Murillo J. & Bonilla J. A.",1982,"Cutaneous leishmaniasis in Honduras, Central America.","Transactions of the Royal Society of Tropical Medicine and Hygiene, 76: 276-277."
94,"Lainson R., Ward R. D. & Shaw J. J.",1976,"Cutaneous leishmaniasis in North Brazil : Lutzomyia anduzei as a major vector.","Transactions of the Royal Society of Tropical Medicine and Hygiene, 70(2): 171-172."
95,"Silveira F. T., Souza A. A. A., Lainson R., Shaw J. J., Braga R. R. & Ishikawa E.",1991,"Cutaneous leishmaniasis in the Amazon region : natural infection of the sandfly Lutzomyia ubiquitalis (Psychodidae : Phlebotominae) by Leishmania (Viannia) lainsoni in Para State, Brazil.","Memórias do Instituto Oswaldo Cruz, (Rio de Janeiro), 86(1): 127-130."
96,"",,"",""
97,"",,"",""
98,"",,"",""
99,"",,"",""
100,"",,"",""
101,"",,"",""
102,"",,"",""
103,"",,"",""
104,"",,"",""
105,"",,"",""
106,"",,"",""
107,"",,"",""
108,"",,"",""
109,"",,"",""
110,"Martins A. V., Falcão A. L. & Silva J. E.",1975,"Descrição da fêmea de Lutzomyia teratodes Martins, Falcão & Silva, 1964 (Diptera, Psychodidae, Phlebotominae).","Revista brasileira de biologia, (Rio de Janeiro), 35(3): 515-517."
111,"Galati E. A. B. & Gomes A. C.",1977,"Descrição da fêmea de Lutzomyia termitophila Martins, Falcão & Silva, 1964 (Diptera, Psychodidae, Phlebotominae).","Revista brasileira de entomologia, 21(2): 63-64."
112,"Martins A. V., Falcão A. L., Silva J. E. & Miranda Fo R.",1983,"Descrição da fêmea de Lutzomyia wilsoni (Damasceno & Causey, 1945) (Diptera, Psychodidae, Phlebotominae).","Memórias do Instituto Oswaldo Cruz, (Rio de Janeiro), 78(1): 67-70."
113,"Mangabeira Fo O. & Sherlock I. A.",1961,"Descrição de 4 novas espécies de Phlebotominae da Bahia (Diptera, Psychodidae).","Revista brasileira de biologia, (Rio de Janeiro), 21(3): 265-276."
114,"Cáceres A. & Galati E. A. B.",1988,"Descrição de Lutzomyia ayacuchensis sp.n. (Diptera, Psychodidae, Phlebotominae) dos Andes Peruanos.","Revista brasileira de entomologia, 32(1): 55-61."
115,"Galati E. A. B. & Cáceres A.",1990,"Descrição de Lutzomyia blancasi, sp.n. e Lutzomyia tejadai sp.n. (Diptera, Psychodidae, Phlebotominae) dos Andes Peruanos.","Revista brasileira de entomologia, 34(3): 505-521."
116,"Blancas F., Cáceres A. & Galati E. A. B.",1989,"Descrição de Lutzomyia caballeroi sp.n. (Diptera, Psychodidae, Phlebotominae) dos Andes Peruanos.","Revista brasileira de entomologia, 33(3): 455-463."
117,"Damasceno R. G. & Arouck R.",1950,"Descrição de uma nova espécie de flebótomo encontrada no Estado da Bahia, Flebotomus digitatum (Diptera, Psychodidae).","Revista do Serviço especial de saúde pública, 3(2): 465-471."
118,"Damasceno R. G. & Arouck R.",1956,"Descrição de uma nova espécie do Flebotomus encontrada no Estado de Minas Gerais, Flebotomus rachoui (Diptera, Psychodidae).","13 pp. Mimeograph-paper, XIII Congr. Brasil. Hyg., Fortaleza (Ceará) (Brazil)."
119,"Dias E. S., Falcão A. L., Silva J. E. & Martins A. V.",1987,"Descrição de uma nova espécie do subgênero Helcocyrtomyia, Lutzomyia capixaba sp.n. (Diptera, Psychodidae, Phlebotominae).","Memórias do Instituto Oswaldo Cruz, (Rio de Janeiro), 82(2): 193-196."
120,"Dias E. S., Martins A. V., Falcão A. L. & Silva J. E.",1986,"Descrição de uma nova espécie do subgênero Helcocyrtomyia, Lutzomyia pusilla sp.n. (Diptera, Psychodidae, Phlebotominae).","Memórias do Instituto Oswaldo Cruz, (Rio de Janeiro), 81(4): 395-399."
121,"Fonseca F.",1939,"Descrição do macho de Flebotomus arthuri Fonseca, 1936 (Diptera, Psychodidae).","Memórias do Instituto Butantan, (São Paulo), 12: 181-185."
123,"Ortíz I.",1954,"Descripción de dos nuevas especies del genero Phlebotomus Rondani (Diptera, Psychodidae) de Venezuela","Acta Biologica Venezuelica, 1(14): 231-250."
124,"Cazorla D. & Añez N.",1988,"Descripción de la hembra de Lutzomyia ceferinoi (Ortiz & Alvarez, 1963) y redescripción del macho.","Memórias do Instituto Oswaldo Cruz, (Rio de Janeiro), 83(3): 313-322."
125,"Morales A., Rodríguez M. C. de & Ibagos A. L.",1982,"Descripción de la hembra de Lutzomyia scaffi (Damasceno & Arouck, 1956) (Diptera, Psychodidae).","Biomedica, 2(1): 17-21."
127,"Arredondo C.",1987,"Descripción del macho y de la hembra de Lutzomyia larensis n.sp. (Diptera, Psychodidae, Phlebotominae) del Estado Lara, Venezuela).","Memórias do Instituto Oswaldo Cruz, (Rio de Janeiro), 82(3): 395-398."
128,"Floch H. & Abonnenc E.",1945,"Description d'un phlébotome nouveau de la Guadeloupe.","Archives de l'Institut Pasteur de la Guyane et du territoire de l'Inini, 96: 1-4."
129,"Le Pont F. & Pajot F. X.",1980,"Description de la femelle de Lutzomyia claustrei Abonnenc, Léger & Fauran, 1979 (Diptera, Psychodidae).","Cahiers ORSTOM, série Entomologie Médicale et Parasitologie, 18(1): 61-65."
130,"Williams P. & Carvalho A. L. M.",1979,"Description of the female of Lutzomyia (Lutzomyia) dispar, with a redescription of the male (Diptera, Psychodidae, Phlebotominae).","Journal of Medical Entomology, 16(4): 325-330."
131,"Forattini O. P. & Galati E. A. B.",1977,"Description of the female of Psychodopygus ayrozai (Barreto and Coutinho) (Diptera, Phlebotominae).","Proceedings of the Entomological Society of Washington, 79(1): 25-27."
132,"Williams P.",1987,"Description of Lutzomyia (Coromyia) disneyi n.sp. (Diptera, Psychodidae, Phlebotominae) from Belize, Central America.","Memórias do Instituto Oswaldo Cruz, (Rio de Janeiro), 82(4): 525-529."
133,"Williams P.",1988,"Descriptions of syntypes of Brumptomyia brumpti (Larrousse, 1920) (Diptera, Psychodidae, Phlebotominae).","Memórias do Instituto Oswaldo Cruz, (Rio de Janeiro), 83(3): 335-341."
134,"Coelho M. V., Falcão A. R. & Falcão A. L.",1967,"Desenvolvimento de espécies do gênero Leishmania em espécies brasileiras de flebótomos do gênero Lutzomyia França, 1924. 1 - Evolução de L.braziliensis em flebótomos.","Revista do Instituto de medicina tropical de São Paulo, 9: 179-191."
135,"",,"",""
136,"",,"",""
137,"Lewis D. J., Lainson R. & Shaw J. J.",1970,"Determination of parous rates in Phlebotomine sandflies with special reference to Amazonian species.","Bulletin of Entomological Research, (London), 60(2): 209-219."
139,"Floch H. & Abonnenc E.",1952,"Diptères phlébotomes de la Guyane et des Antilles françaises.","207 pp. ORSTOM, Paris (France)."
140,"Coquillett D. W.",1907,"Discovery of blood-sucking Psychodidae in America.","Entomological News, (Philadelphia), 18: 101-102."
141,"Mogollón J., Manzanilla P. & Scorza J. V.",1977,"Distribución altitudinal de nueve especies de Lutzomyia (Diptera, Psychodidae) en el Estado Trujillo, Venezuela.","Boletín de la Dirección de Malariologia y Saneamiento Ambiental, 17: 206-223."
142,"Romaña C. & Abalos J.  W.",1949,"Distribución de flebótomos y leishmaniosis tegumentaria en la Argentina.","Anales del Instituto de Medicina Regional, (Tucumán), 2: 293-302."
143,"Corredor A., Kreutzer R. D., Tesh R. B., Boshell J., Palau M. T., Caceres E., Duque S., Peláez D., Rodríguez G., Nichols S., Hernández C. A., Morales A., Young D. G. & Ferro C.",1990,"Distribution and etiology of leishmaniasis in Colombia.","American Journal of Tropical Medicine and Hygiene, 42(3): 206-214."
145,"Chaniotis B. N., Tesh R. B., Correa M. A. & Johnson K. M.",1972,"Diurnal resting sites of phlebotomine sandflies in a Panamanian tropical forest.","Journal of Medical Entomology, 9: 91-98."
146,"Vargas L. & Díaz Nájera A.",1952,"Dos flebótomos nuevos de México (Diptera, Psychodidae).","Revista de la Sociedad mexicana de historia natural, 13(1): 63-74."
147,"Barretto M. P.",1950,"Duas novas espécies de flebótomos brasileiros (Diptera, Psychodidae).","Folia clinica et biologica, 16: 143-149."
148,"Tesh R. B., Chaniotis B. N., Peralta P. H. & Johnson K. M.",1974,"Ecology of viruses isolated from Panamanian phlebotomine sand flies.","American Journal of Tropical Medicine and Hygiene, 23: 258-269."
149,"Forattini O. P.",1973,"Entomologia Médica. IV. Psychodidae Phlebotominae. Leishmanioses. Bartonelose.","658 pp. Edgard Blücher L.T.D.A./ Editora da Universidade de São Paulo, São Paulo (Brazil)."
677,"Feliciangeli M. D.",1995,"Phlebotomine sandflies in Venezuela. IV. Review of the Lutzomyia subgenus Micropygomyia (Diptera : Psychodidae), with a description of Lutzomyia absonodonta n. sp. and the male of Lutzomyia lewisi.","Annals of Tropical Medicine and Parasitology, 89(5): 551-567."
